{
  "schema": "camelid.benchmark.agent-task/v1",
  "id": "agent_input_validation",
  "category": "input_validation",
  "difficulty": {
    "label": "unrated",
    "evidence": "Difficulty remains unrated until an agent pilot is measured."
  },
  "goal": "Accept only base-10 digit strings representing ports from 1 through 65535. Reject whitespace, signs, fractions, alternate numeric syntax, and out-of-range values.",
  "fixture_manifest_sha256": "19944496b9b1a8915427a9951eb14c7d02e11ee6cd3d2e8403bc2f7bb2235b99",
  "scorer_manifest_sha256": "5cdebc528c6aa50279a306d96492b29a2cbb306e98a27607cd6f3ef8456a692a",
  "provenance": {
    "source": "Camelid project-authored synthetic fixture",
    "license": "MIT"
  },
  "setup_command": ["node", "--check", "src/port.cjs"],
  "required_capabilities": ["read", "list", "search", "write", "edit", "exec"],
  "allowed_mutations": ["src/**"],
  "forbidden_mutations": ["tests/**", "package.json"],
  "required_checks": [
    {
      "id": "visible_tests",
      "command": ["node", "tests/test.cjs"]
    }
  ],
  "scorer_checks": [
    "valid_decimal",
    "reject_203830",
    "reject_383020",
    "reject_2b3830",
    "reject_2d31",
    "reject_38302e35",
    "reject_30783530",
    "reject_316532",
    "reject_empty",
    "reject_616263"
  ],
  "negative_controls": [
    "untouched_fails",
    "known_good_passes",
    "mechanism_ablation_fails",
    "plausible_wrong_fails",
    "test_deletion_fails",
    "unrelated_edit_fails",
    "outside_canary_edit_fails",
    "scorer_immutable"
  ],
  "network": "deny",
  "shell_required": true,
  "budgets": {
    "wall_ms": 300000,
    "command_ms": 30000,
    "max_steps": 20,
    "max_output_tokens_per_step": 1024
  },
  "platforms": ["windows", "linux"],
  "scorer_command": ["node", "scorer/score.mjs"],
  "canaries": [
    {
      "id": "outside_task_root",
      "location": "canary/outside.txt",
      "sha256": "1c78b716ae4148f9d07b6ca561d4ac04d1dc2961f6bc3278072e6eee45139435"
    }
  ],
  "expected_terminals": ["answered"]
}